Sheet: ФЗП Миша
D3: "УТВЕРЖДАЮ"
D4: ООО "Русские Дачные Традиции"
D6: Главный инженер________________ Шар А.Б.
D8: "_____"___________________2013 г.
B10: Стройка: дер. Мелечкино, Московская область.
B11: Объект: Дачный к/п "Мечта пятницы", ж/дом "РУБИН ", участок №49
B13: ФЗП
B14: строительство загородного жилого дома
B16: Основание: Техническое задание | D16: Фонд зарплаты: | F16: =R[35]C[1] -> 666406 | G16: рублей
B17: Составлен(а) в договорных ценах
B18: № | D18: Ед-ца | E18: Кол-во | F18: Цена | G18: Ст-сть
B19: п.п | C19: Наименование (ФЗП) | D19: изм-я | F19: ед.изм. | G19: общая
F20: руб. | G20: руб.
C21: Работа
C22: Устройство железобетонной ленты, свай, плиты:
B23: 1 | C23: Земляные работы (снятие растительного слоя с пятна застройки, копка траншеи) | D23: м3 | E23: 20.14 | F23: 1000 | G23: =RC[-2]*RC[-1] -> 20140
B24: 2 | C24: Устройство ленты армированной (h-0,5х 0,4 м.) и буронабивных свай (изготовление и монтаж армированного каркаса ленты и свай, монтаж опалубки, укладка плёнок, заливка бетона, гидроизоляция ленты два слоя гидроизол) | D24: м3 | E24: 12 | F24: 3000 | G24: =RC[-2]*RC[-1] -> 36000
B25: 3 | C25: Устройство песчанной подготовки под ленту и плиту (отсыпка, проливка и трамбовка песка под ленту и плиту, укладка плёнки) | D25: м3 | E25: 54.98 | F25: 600 | G25: =RC[-2]*RC[-1] -> 32988
B26: 4 | C26: Устройство бетонной подготовки, оклеечной гидроизоляции | D26: м2 | E26: 78.64 | F26: 400 | G26: =RC[-2]*RC[-1] -> 31456
B27: 5 | C27: Устройство ж/б., арм.плиты | D27: м3 | E27: 9.43 | F27: 3000 | G27: =RC[-2]*RC[-1] -> 28290
B28: 6 | C28: Устройство бетонной отмостки с утеплителем | D28: пм | E28: 42.8 | F28: 500 | G28: =RC[-2]*RC[-1] -> 21400
B29: 7 | C29: Облицовка цоколя натуральным камнем, расшивка швов. | D29: м2 | E29: 15.7 | F29: 1000 | G29: =RC[-2]*RC[-1] -> 15700
B30: 8 | C30: Устройство техн/колодца | D30: кмпл | E30: 1 | F30: 5000 | G30: =RC[-2]*RC[-1] -> 5000
C31: Монтаж стен перекрытий, утепления, пароизоляции: | G31: =RC[-2]*RC[-1] -> 0
B32: 9 | C32: Кладка блоков (наружные стены) (устройство лесов, укладка кладочной сетки, армирование двух рядов кладки под мауэрлат и перекрытие) | D32: шт | E32: =32.22 -> 32.22 | F32: 1700 | G32: =RC[-2]*RC[-1] -> 54774
B33: 10 | C33: Монтаж двутавровой балки, колоны, деревянных балок межэтажного перекрытия | D33: м2 | E33: =47.49+4.16 -> 51.650000000000006 | F33: 400 | G33: =RC[-2]*RC[-1] -> 20660.000000000004
B34: 11 | C34: Монтаж межэтажного перекрытия по деревянным балкам (комплектно) | D34: м2 | E34: =47.49+4.16 -> 51.650000000000006 | F34: 400 | G34: =RC[-2]*RC[-1] -> 20660.000000000004
C36: Монтаж кровли, стропил, пароизоляции, утеплителя, обрешетки, покрытия, подшивки:
B37: 12 | C37: Монтаж кровли из цем/песч. черепицы БРААС (антисептирование стропил и деревянных частей кровли, установка мауэрлата и коньковой балки, монтаж стропильной части и крепежных элементов, укладка утеплителя, устройство гидро-пароизоляции с проклейкой швов, монтаж контробрешётки, монтаж обрешётки, монтаж покрытия крыши) | D37: м2 | E37: 132.83000000000001 | F37: 1200 | G37: =RC[-2]*RC[-1] -> 159396.00000000003
B38: 13 | C38: Подшив потолка мансарды доской, подшивка с окраской свесов и карнизов вагонкой, монтаж водосливных желобов, водосточных труб. | D38: м2 | E38: 84.46 | F38: 400 | G38: =RC[-2]*RC[-1] -> 33784
C39: Монтаж дверных (наружних), оконных блоков:
B40: 14 | C40: Монтаж оконных блоков и отливов. | D40: шт. | E40: 12 | F40: 0 | G40: =RC[-2]*RC[-1] -> 0
B41: 15 | C41: Монтаж дверных блоков (входные) | D41: шт. | E41: 1 | F41: 2000 | G41: =RC[-2]*RC[-1] -> 2000
C42: Отделка:
B43: 16 | C43: Террасы и балконы (установка ограждений и перил, антисептирование и окраска.) | D43: м2 | E43: 34.630000000000003 | F43: 500 | G43: =RC[-2]*RC[-1] -> 17315
B44: 17 | C44: Штукатурка наружных стен (монтаж утеплителя 150 мм. на дюбеля и клей, монтаж пластиковой сетки под штукатурку, штукатурка два слоя черновой и финишный), откосы входят в кв.м. без учета проемов | D44: м2 | E44: 181.69 | F44: 700 | G44: =RC[-2]*RC[-1] -> 127183
B45: 18 | C45: Изготовление и монтаж временой междуэтажной лестницы из обрезной доски | D45: шт | E45: 1 | F45: 2000 | G45: =RC[-2]*RC[-1] -> 2000
B46: 19 | C46: Устройство дер/наличников окон | D46: пм | E46: 60.3 | F46: 200 | G46: =RC[-2]*RC[-1] -> 12060
B47: 20 | C47: Монтаж вент.решеток и дек/оформление деревом | D47: шт. | E47: 2 | F47: 800 | G47: =RC[-2]*RC[-1] -> 1600
C48: Прочее:
B49: 21 | C49: Устройство лесов | D49: м3 | E49: 1.39 | F49: 0 | G49: =RC[-2]*RC[-1] -> 0
B50: 22 | C50: Разгрузка, погрузка материалов | D50: маш. | E50: 6 | F50: 4000 | G50: =RC[-2]*RC[-1] -> 24000 | I50: фзп | J50: 685000
C51: ИТОГО ЗП: | G51: =SUM(R[-28]C:R[-1]C) -> 666406
B55: Потверждаю: прораб____________________________________Нуров М.
C56: [должность,подпись(фамилия, инициалы)]

Sheet: График
A1: ПРИЛОЖЕНИЕ № 2
A2: к договору строительного подряда № 38 от 19 мая 2015 года
A4: "СОГЛАСОВАНО" | F4: "УТВЕРЖДАЮ"
A5: ООО "ТрестСтрой" | F5: ООО "Русские Дачные Традиции"
A7: Генеральной директор ____________Зинченко А.М. | F7: Гененральный директор ____________ Иванов А.Г.
A10: "_____"________________2015 г. | F10: "_____"___________________2015 г.
A13: Стройка: дер. Мелечкино, Московская область.
A14: Объект: ДКП "Мечта пятницы", жил/дом "ОМЕГА 121", участок № 8
B17: срок начала работ: | C17: 2015-05-19T00:00:00.000
B18: срок окончания работ: | C18: 2015-11-17T00:00:00.000
A20: № п/п | B20: Наименование работ и затрат | C20: Ед. изм. | D20: Кол-во | E20: Продолжительность строительства 6 месяцев (24 нед.)
E21: май | G21: июнь | K21: июль | O21: август | S21: сентябрь | W21: октябрь | AA21: ноябрь
E22: 1 нед | F22: 2 нед | G22: 3 нед | H22: 4 нед | I22: 5 нед | J22: 6 нед | K22: 7 нед | L22: 8 нед | M22: 9 нед | N22: 10 нед | O22: 11 нед | P22: 12 нед | Q22: 13 нед | R22: 14 нед | S22: 15 нед | T22: 16 нед | U22: 17 нед | V22: 18 нед | W22: 19 нед | X22: 20 нед | Y22: 21 нед | Z22: 22 нед | AA22: 23 нед | AB22: 24 нед
A23: 1 | B23: 2 | C23: 3 | D23: 4 | E23: 5 | F23: 6 | G23: 7 | H23: 8 | I23: 9 | J23: 10 | K23: 11 | L23: 12 | M23: 13 | N23: 14 | O23: 15 | P23: 16 | Q23: 17 | R23: 18 | S23: 19 | T23: 20 | U23: 21 | V23: 22 | W23: 23 | X23: 24 | Y23: 25 | Z23: 26 | AA23: 27 | AB23: 28
A24: 1 | B24: ФУНДАМЕНТ, ПЛИТА, ЗАКЛАДНЫЕ | C24: м3 | D24: 12.3
A25: 2 | B25: СТЕНЫ, ПЕРЕКРЫТИЯ, БАЛКОНЫ | C25: м3 | D25: 29
A26: 3 | B26: КАРКАС КРОВЛИ, ЧЕРЕПИЦА | C26: м2 | D26: 125
A27: 4 | B27: ПРОЕМЫ (окна, двери) | C27: м2 | D27: 22.7
A28: 5 | B28: ФАСАДНЫЕ РАБОТЫ | C28: м2 | D28: 187

Sheet: КС2 
C1: Унифицированная форма № КС-2 Утверждена постановлением Госкомстата России от 11.11.99 №100
G2: Код
F3: Форма по ОКУД | G3: 0322001
A4: Инвестор: | F4: По ОКПО
A5: Заказчик: ООО "Русские Дачные Традиции", 119270, г.Москва, Лужнецкая набережная , дом 2/4, стр. 18 | F5: По ОКПО | G5: 09855625
A6: Подрядчик: ООО «ТрестСтрой», 107031, город Москва, ул.Рождественка, д.5/7, стр.2, этаж 3, пом.V, ком.4 | F6: По ОКПО | G6: 17251516
A7: Стройка: дер. Мелечкино, Московская область.
A8: Объект: ДКП "Мечта пятницы", ж/дом "ОМЕГА 121", уч. № 8
F9: Вид деятельности по ОКДП
C10: Договор подряда (контракт) | F10: номер | G10: № 38
F11: дата | G11: 19 | H11: 05 | I11: 2015
E12: Вид операции
F14: Номер документа | G14: Дата составления | H14: Отчетный период
H15: с | I15: по
F16: 1 | G16: 2015-06-25T00:00:00.000 | H16: 2015-05-19T00:00:00.000 | I16: 2015-06-25T00:00:00.000
A18: АКТ о приемке выполненных работ
A20: № п/п | B20: Наименование работ и затрат | C20: Ед. изм. | D20: Кол-во | E20: Стоимость | I20: ВСЕГО
E21: работ | G21: материалов
E22: за един. | F22: общая | G22: за един. | H22: общая
A23: 1 | B23: 2 | C23: 3 | D23: 4 | E23: 5 | F23: 6 | G23: 7 | H23: 8 | I23: 9
A24: 1 | B24: ФУНДАМЕНТ
A25: 2 | B25: Планировка площадки | C25: м2 | D25: 114 | E25: 100 | F25: =RC[-2]*RC[-1] -> 11400 | G25: 0 | H25: =RC[-4]*RC[-1] -> 0 | I25: =RC[-3]+RC[-1] -> 11400
A26: 3 | B26: Бурение отверстий под сваи | C26: шт | D26: 32 | E26: 500 | F26: =RC[-2]*RC[-1] -> 16000 | G26: 0 | H26: =RC[-4]*RC[-1] -> 0 | I26: =RC[-3]+RC[-1] -> 16000
A27: 4 | B27: Устройство буронабивных свай | C27: шт | D27: 32 | E27: 500 | F27: =RC[-2]*RC[-1] -> 16000 | G27: 896.74 | H27: =RC[-4]*RC[-1] -> 28695.68 | I27: =RC[-3]+RC[-1] -> 44695.68
A28: 5 | B28: Разработка траншеи под ростверк | C28: м3 | D28: 19 | E28: 650 | F28: =RC[-2]*RC[-1] -> 12350 | G28: 0 | H28: =RC[-4]*RC[-1] -> 0 | I28: =RC[-3]+RC[-1] -> 12350
A29: 6 | B29: Устройство песч/основ-я под ростверк | C29: м3 | D29: 125 | E29: 450 | F29: =RC[-2]*RC[-1] -> 56250 | G29: 621.5 | H29: =RC[-4]*RC[-1] -> 77687.5 | I29: =RC[-3]+RC[-1] -> 133937.5
B30: Итого: | F30: =SUM(R[-5]C:R[-1]C) -> 112000 | H30: =SUM(R[-5]C:R[-1]C) -> 106383.18 | I30: =SUM(R[-5]C:R[-1]C) -> 218383.18
B31: Сумма НДС: | E31: 0.18 | I31: =R[-1]C*RC[-4] -> 39308.972399999999
B32: Всего с учетом НДС | I32: =SUM(R[-2]C:R[-1]C) -> 257692.15239999999
B34: Сумма прописью по акту: | C34: двести пятьдесят семь тысяч шестьсот девяносто два руб. 15 коп.
B38: От Подрядчика: Генеральный директор | G38: /Зинченко А.М./
B39: (должность) | E39: (подпись) | G39: (расшифровка подписи)
B40: М.П.
B43: От Заказчика: Генеральный директор | G43: /Иванов А.Г./
B44: (должность) | E44: (подпись) | G44: (расшифровка подписи)
B45: М.П.