Sheet: КС2 
D1: Унифицированная форма № КС-2 Утверждена постановлением Госкомстата России от 11.11.99 №100
F2: Код
E3: Форма по ОКУД | F3: 0322001
A4: Инвестор: | E4: По ОКПО
A5: Заказчик: ООО "Русские Дачные Традиции", 119270, г.Москва, Лужнецкая набережная , дом 2/4, стр. 18 | E5: По ОКПО | F5: 09855625
A6: Подрядчик: ООО «ТрестСтрой», 107031, город Москва, ул.Рождественка, д.5/7, стр.2, этаж 3, пом.V, ком.4 | E6: По ОКПО | F6: 17251516
A7: Стройка: дер. Мелечкино, Московская область.
A8: Объект: ДКП "Мечта пятницы", ж/дом "ОМЕГА 121", уч. № 8
E9: Вид деятельности по ОКДП
C10: Договор подряда (контракт) | E10: номер | F10: № 38
E11: дата | F11: 19 | G11: 05 | H11: 2015
E14: Номер документа | F14: Дата составления | G14: Отчетный период
G15: с | H15: по
E16: 1 | F16: 2015-06-25T00:00:00.000 | G16: 2015-05-19T00:00:00.000 | H16: 2015-06-25T00:00:00.000
A18: АКТ о приемке выполненных работ
A20: Номер | C20: Наименование работ | D20: Номер единичной расценки | E20: Ед. изм. | F20: Выполнено работ
A21: по порядку | B21: позиции по смете | F21: Количество | G21: цена за единицу, руб. | H21: стоимость
A22: 1 | B22: 2 | C22: 3 | D22: 4 | E22: 5 | F22: 6 | G22: 7 | H22: 8
A23: 1 | C23: ФУНДАМЕНТ
A24: 2 | C24: Планировка площадки | D24: договорная | E24: м2 | F24: 200 | G24: 5 | H24: =RC[-1]*RC[-2] -> 1000
A25: 3 | C25: Бурение отверстий под сваи | D25: договорная | E25: шт | F25: 200 | G25: 10 | H25: =RC[-1]*RC[-2] -> 2000
A26: 4 | C26: Устройство буронабивных свай | D26: договорная | E26: шт | F26: 200 | G26: 896.74 | H26: =RC[-1]*RC[-2] -> 179348
A27: 5 | C27: Разработка траншеи под ростверк | D27: договорная | E27: м3 | F27: 200 | G27: 300 | H27: =RC[-1]*RC[-2] -> 60000
A28: 6 | C28: Устройство песч/основ-я под ростверк | D28: договорная | E28: м3 | F28: 200 | G28: 621.5 | H28: =RC[-1]*RC[-2] -> 124300
D29: Итого: | F29: =SUM(R[-5]C:R[-1]C) -> 1000 | G29: Х | H29: =SUM(R[-5]C:R[-1]C) -> 366648
D30: Сумма НДС: | F30: =R[-1]C -> 1000 | G30: Х | H30: =R[-1]C*18/118 -> 55929.355932203391
D31: Всего по акту с учетом НДС | F31: =R[-1]C -> 1000 | G31: Х | H31: =R[-2]C+R[-1]C -> 422577.35593220341
C33: Сумма прописью по акту: | D33: двести пятьдесят семь тысяч шестьсот девяносто два руб. 15 коп.
C37: От Подрядчика: Генеральный директор | G37: /Зинченко А.М./
C38: (должность) | E38: (подпись) | G38: (расшифровка подписи)
C39: М.П.
C42: От Заказчика: Генеральный директор | G42: /Иванов А.Г./
C43: (должность) | E43: (подпись) | G43: (расшифровка подписи)
C44: М.П.

Sheet: Лист1
D1: Унифицированная форма № КС-2 Утверждена постановлением Госкомстата России от 11.11.99 №100
F2: Код
E3: Форма по ОКУД | F3: 0322001
A4: Инвестор: | E4: По ОКПО
A5: Заказчик: ООО "Русские Дачные Традиции", 119270, г.Москва, Лужнецкая набережная , дом 2/4, стр. 18 | E5: По ОКПО | F5: 09855625
A6: Подрядчик: ООО «ТрестСтрой», 107031, город Москва, ул.Рождественка, д.5/7, стр.2, этаж 3, пом.V, ком.4 | E6: По ОКПО | F6: 17251516
A7: Стройка: дер. Мелечкино, Московская область.
A8: Объект: ДКП "Мечта пятницы", ж/дом "ОМЕГА 121", уч. № 8
E9: Вид деятельности по ОКДП
C10: Договор подряда (контракт) | E10: номер | F10: № 38
E11: дата | F11: 19 | G11: 05 | H11: 2015
E14: Номер документа | F14: Дата составления | G14: Отчетный период
G15: с | H15: по
E16: 1 | F16: 2015-06-25T00:00:00.000 | G16: 2015-05-19T00:00:00.000 | H16: 2015-06-25T00:00:00.000
A18: АКТ о приемке выполненных работ
A20: Номер | C20: Наименование работ | D20: Номер единичной расценки | E20: Ед. изм. | F20: Выполнено работ
A21: по порядку | B21: позиции по смете | F21: Количество | G21: цена за единицу, руб. | H21: стоимость
A22: 1 | B22: 2 | C22: 3 | D22: 4 | E22: 5 | F22: 6 | G22: 7 | H22: 8
A23: 1 | C23: ФУНДАМЕНТ
A24: 2 | C24: Планировка площадки | D24: договорная | E24: м2 | F24: 200 | G24: 5 | H24: =RC[-1]*RC[-2] -> 1000
A25: 3 | C25: Бурение отверстий под сваи | D25: договорная | E25: шт | F25: 200 | G25: 10 | H25: =RC[-1]*RC[-2] -> 2000
A26: 4 | C26: Устройство буронабивных свай | D26: договорная | E26: шт | F26: 200 | G26: 896.74 | H26: =RC[-1]*RC[-2] -> 179348
A27: 5 | C27: Разработка траншеи под ростверк | D27: договорная | E27: м3 | F27: 200 | G27: 300 | H27: =RC[-1]*RC[-2] -> 60000
A28: 6 | C28: Устройство песч/основ-я под ростверк | D28: договорная | E28: м3 | F28: 200 | G28: 621.5 | H28: =RC[-1]*RC[-2] -> 124300
D29: Итого: | F29: =SUM(R[-5]C:R[-1]C) -> 1000 | G29: Х | H29: =SUM(R[-5]C:R[-1]C) -> 366648
D30: Сумма НДС: | F30: =R[-1]C -> 1000 | G30: Х | H30: =R[-1]C*18/118 -> 55929.355932203391
D31: Всего по акту с учетом НДС | F31: =R[-1]C -> 1000 | G31: Х | H31: =R[-2]C+R[-1]C -> 422577.35593220341
C33: Сумма прописью по акту: | D33: двести пятьдесят семь тысяч шестьсот девяносто два руб. 15 коп.
C37: От Подрядчика: Генеральный директор | G37: /Зинченко А.М./
C38: (должность) | E38: (подпись) | G38: (расшифровка подписи)
C39: М.П.
C42: От Заказчика: Генеральный директор | G42: /Иванов А.Г./
C43: (должность) | E43: (подпись) | G43: (расшифровка подписи)
C44: М.П.